{
  "schema_version": 1,
  "map_id": "ankara-concept-6a1-dry-run-map",
  "map_version": "2026.09.21",
  "source_type": "controlled_fixture_planning_inventory",
  "source_citation": "Synthetic map for Concept 6A.1 tooling tests; no field transmitter truth claim.",
  "entries": [
    {
      "atom_cell_id": "atom-lte-001",
      "observed_cell_id": "1001",
      "observed_pci": 101,
      "plmn": "28601",
      "site_id": "site-lte-001",
      "lat": 39.9113,
      "lon": 32.8477,
      "antenna_height_m": 25,
      "azimuth_deg": 0,
      "tilt_deg": 0,
      "frequency_ghz": 2.6,
      "bandwidth_mhz": 20,
      "tx_power_dbm": 30,
      "rf_profile": {
        "schema_version": 1,
        "network_tech": "4g",
        "propagation_model": "urban_short_range",
        "frequency_ghz": 2.6,
        "band": "LTE Band 7",
        "bandwidth_mhz": 20,
        "channel_id": "earfcn:2850",
        "duplex_mode": "fdd",
        "tx_power_dbm": 30,
        "antenna_gain_dbi": 25,
        "rx_antenna_gain_dbi": 0,
        "system_loss_db": 0,
        "polarization_loss_db": 0,
        "radius_m": 5000,
        "beam_width": 360,
        "antenna_height_m": 25,
        "mechanical_downtilt_deg": 0,
        "electrical_downtilt_deg": 0,
        "orientation_deg": 0,
        "horizontal_pattern_id": "ideal-sector",
        "vertical_pattern_id": "flat",
        "load_factor": 0.7,
        "reuse_factor": 1,
        "pci": 101,
        "receiver_height_m": 1.8,
        "receiver_sensitivity_dbm": -115,
        "receiver_sensitivity_mode": "manual",
        "receiver_noise_bandwidth_hz": 20000000,
        "receiver_noise_bandwidth_source": "channel_bandwidth_approximation",
        "receiver_noise_figure_db": 7,
        "receiver_required_snr_db": 3,
        "receiver_margin_db": 0
      },
      "field_provenance": {
        "atom_cell_id": {"status": "configured", "source": "synthetic fixture map", "note": "modeled identity"},
        "observed_cell_id": {"status": "known", "source": "Signal Collector V6 cell_id", "note": "exact receive-side identity key"},
        "site_coordinates": {"status": "configured", "source": "synthetic fixture map", "note": "not a field survey claim"},
        "antenna_height_m": {"status": "configured", "source": "synthetic planning profile", "note": "modeled transmitter profile"},
        "azimuth_deg": {"status": "configured", "source": "synthetic planning profile", "note": "not inferred from handset data"},
        "tilt_deg": {"status": "configured", "source": "synthetic planning profile", "note": "not inferred from handset data"},
        "frequency_ghz": {"status": "configured", "source": "synthetic planning profile", "note": "compared with raw frequency; never used to fill missing raw frequency"},
        "bandwidth_mhz": {"status": "configured", "source": "synthetic planning profile", "note": "not copied into raw observations"},
        "tx_power_dbm": {"status": "configured", "source": "synthetic planning profile", "note": "not measured by handset"},
        "provenance": {"status": "known", "source": "fixture authoring record", "note": "all values are synthetic"}
      },
      "source_citation": "Synthetic fixture only"
    },
    {
      "atom_cell_id": "atom-nr-001",
      "observed_cell_id": "2001",
      "observed_pci": 201,
      "plmn": "28601",
      "site_id": "site-nr-001",
      "lat": 39.9118,
      "lon": 32.8482,
      "antenna_height_m": 25,
      "azimuth_deg": 0,
      "tilt_deg": 0,
      "frequency_ghz": 28,
      "bandwidth_mhz": 100,
      "tx_power_dbm": 30,
      "rf_profile": {
        "schema_version": 1,
        "network_tech": "5g",
        "propagation_model": "urban_short_range",
        "frequency_ghz": 28,
        "band": "NR n257",
        "bandwidth_mhz": 100,
        "channel_id": "nrarfcn:205416",
        "duplex_mode": "tdd",
        "tx_power_dbm": 30,
        "antenna_gain_dbi": 25,
        "rx_antenna_gain_dbi": 0,
        "system_loss_db": 0,
        "polarization_loss_db": 0,
        "radius_m": 5000,
        "beam_width": 360,
        "antenna_height_m": 25,
        "mechanical_downtilt_deg": 0,
        "electrical_downtilt_deg": 0,
        "orientation_deg": 0,
        "horizontal_pattern_id": "ideal-sector",
        "vertical_pattern_id": "flat",
        "load_factor": 0.7,
        "reuse_factor": 1,
        "pci": 201,
        "receiver_height_m": 1.8,
        "receiver_sensitivity_dbm": -115,
        "receiver_sensitivity_mode": "manual",
        "receiver_noise_bandwidth_hz": 100000000,
        "receiver_noise_bandwidth_source": "channel_bandwidth_approximation",
        "receiver_noise_figure_db": 7,
        "receiver_required_snr_db": 3,
        "receiver_margin_db": 0
      },
      "field_provenance": {
        "atom_cell_id": {"status": "configured", "source": "synthetic fixture map", "note": "modeled identity"},
        "observed_cell_id": {"status": "known", "source": "Signal Collector V6 cell_id/nci", "note": "exact receive-side identity key"},
        "site_coordinates": {"status": "configured", "source": "synthetic fixture map", "note": "not a field survey claim"},
        "antenna_height_m": {"status": "configured", "source": "synthetic planning profile", "note": "modeled transmitter profile"},
        "azimuth_deg": {"status": "configured", "source": "synthetic planning profile", "note": "not inferred from handset data"},
        "tilt_deg": {"status": "configured", "source": "synthetic planning profile", "note": "not inferred from handset data"},
        "frequency_ghz": {"status": "configured", "source": "synthetic planning profile", "note": "compared with raw frequency; never used to fill missing raw frequency"},
        "bandwidth_mhz": {"status": "configured", "source": "synthetic planning profile", "note": "deliberately absent from the raw NR rows"},
        "tx_power_dbm": {"status": "configured", "source": "synthetic planning profile", "note": "not measured by handset"},
        "provenance": {"status": "known", "source": "fixture authoring record", "note": "all values are synthetic"}
      },
      "source_citation": "Synthetic fixture only"
    }
  ]
}
